<?xml version="1.0" encoding="UTF-8"?>
<Filter xmlns="http://www.af-klm.com/filter"
        xmlns:xsi="http://www.w3.org/2001/XMLSchema-instance"
        xsi:schemaLocation="http://www.af-klm.com/filter filter.xsd">

    <And>
        <In>
            <Attribute>AIRLINE_CODE</Attribute>
            <Value>AF</Value>
            <Value>KL</Value>
            <Value>A5</Value>
        </In>
        <Equals>
            <Attribute>FLIGHT_NUMBER</Attribute>
            <Value>1234</Value>
        </Equals>
        <IsNull>
            <Attribute>OPERATIONAL_SUFFIX</Attribute>
        </IsNull>
    </And>

</Filter>