<?xml version="1.0" encoding="UTF-8"?>
<Filter xmlns="http://www.af-klm.com/filter"
        xmlns:xsi="http://www.w3.org/2001/XMLSchema-instance"
        xsi:schemaLocation="http://www.af-klm.com/filter filter.xsd">

    <Or>
        <In>
            <Attribute>IATA_AIRPORT_CODE</Attribute>
            <Value>MLH</Value>
            <Value>BSL</Value>
        </In>
        <Equals>
            <Attribute>AIRCRAFT_TYPE</Attribute>
            <Value>RFS</Value>
        </Equals>
    </Or>

</Filter>